{"$schema":"https://json-schema.org/draft/2020-12/schema","$id":"urn:open-brain:portable-brain:v1:decision","type":"object","properties":{"actor_id":{"$ref":"urn:open-brain:portable-brain:v1:common#/$defs/actor_id"},"decision_id":{"$ref":"urn:open-brain:portable-brain:v1:common#/$defs/decision_id"},"edited_content":{"oneOf":[{"type":"object","properties":{"bytes_base64":{"type":"string","minLength":1},"sha256":{"$ref":"urn:open-brain:portable-brain:v1:common#/$defs/digest"}},"required":["bytes_base64","sha256"],"additionalProperties":false},{"type":"null"}]},"expected_receipt":{"$ref":"urn:open-brain:portable-brain:v1:common#/$defs/receipt"},"expected_state_digest":{"$ref":"urn:open-brain:portable-brain:v1:common#/$defs/digest"},"outcome":{"enum":["approved","rejected","edited"]},"proposal_id":{"$ref":"urn:open-brain:portable-brain:v1:common#/$defs/proposal_id"},"recorded_at":{"$ref":"urn:open-brain:portable-brain:v1:common#/$defs/timestamp"},"role_claim":{"$ref":"urn:open-brain:portable-brain:v1:common#/$defs/role_claim"},"schema_version":{"const":1},"terminal_digest":{"$ref":"urn:open-brain:portable-brain:v1:common#/$defs/digest"},"tenant_id":{"$ref":"urn:open-brain:portable-brain:v1:common#/$defs/tenant_id"}},"required":["actor_id","decision_id","edited_content","expected_receipt","expected_state_digest","outcome","proposal_id","recorded_at","role_claim","schema_version","terminal_digest","tenant_id"],"allOf":[{"if":{"properties":{"outcome":{"const":"edited"}},"required":["outcome"]},"then":{"properties":{"edited_content":{"type":"object"}}},"else":{"properties":{"edited_content":{"type":"null"}}}}],"additionalProperties":false}
