{"actor_id":"actor_123e4567-e89b-42d3-a456-426614174001","decision_id":"decision_123e4567-e89b-42d3-a456-426614174019","edited_content":null,"expected_receipt":{"kind":"proposal_created","payload":{"proposal_id":"proposal_123e4567-e89b-42d3-a456-426614174018","proposed_content_sha256":"b1e05553e226b8ca75279980b3e6074ffa90c476c4058215f8d047e56716398c"},"receipt_id":"receipt_123e4567-e89b-42d3-a456-426614174121","recorded_at":"2026-08-30T12:00:00Z","sha256":"0b92defad8ca34abb7f59cd4c215a6cdbfd5b96204c299ad9b9b7c8f18af0a96","subject_id":"proposal_123e4567-e89b-42d3-a456-426614174018"},"expected_state_digest":"bd91a5eb13dbf73fa552bcc165f11feaed35f3efe22c587927ff4383e979a4aa","outcome":"approved","proposal_id":"proposal_123e4567-e89b-42d3-a456-426614174018","recorded_at":"2026-08-30T12:06:00Z","role_claim":{"actor_id":"actor_123e4567-e89b-42d3-a456-426614174001","capabilities":["capture.accept","space.write"],"role_claim_id":"role_claim_123e4567-e89b-42d3-a456-426614174003","role_id":"role_123e4567-e89b-42d3-a456-426614174002","tenant_id":"tenant_123e4567-e89b-42d3-a456-426614174000"},"schema_version":1,"tenant_id":"tenant_123e4567-e89b-42d3-a456-426614174000","terminal_digest":"f35f940988e79c4d12b925bd24570b6650f048e9cbecfa79044cef23fd686ea5"}