{"actor_id":"actor_123e4567-e89b-42d3-a456-426614174001","decision_id":"decision_123e4567-e89b-42d3-a456-426614174009","edited_content":{"bytes_base64":"LS0tCmFjdG9yX2lkOiAiYWN0b3JfMTIzZTQ1NjctZTg5Yi00MmQzLWE0NTYtNDI2NjE0MTc0MDAxIgptb2RpZmllZF9hdDogIjIwMjYtMDgtMzBUMTI6MTA6MDBaIgpwYWdlX2lkOiAicGFnZV8xMjNlNDU2Ny1lODliLTQyZDMtYTQ1Ni00MjY2MTQxNzQwMDUiCnByaXZhY3k6IHsiYXV0aG9yaXR5Ijp7ImNsb3VkIjpmYWxzZSwiZXh0ZXJuYWxfZWdyZXNzIjpmYWxzZX0sImNvbmZpcm1hdGlvbl9yZWYiOm51bGwsInBvbGljeV92ZXJzaW9uIjoicHJpdmFjeS12MSIsInJlYXNvbiI6InBlcnNvbmFsX2xvY2FsX29ubHkiLCJ0aWVyIjoicGVyc29uYWwifQpwcm92ZW5hbmNlOiBbImNhcHR1cmVfMTIzZTQ1NjctZTg5Yi00MmQzLWE0NTYtNDI2NjE0MTc0MTAwIl0Kcm9sZV9jbGFpbTogeyJhY3Rvcl9pZCI6ImFjdG9yXzEyM2U0NTY3LWU4OWItNDJkMy1hNDU2LTQyNjYxNDE3NDAwMSIsImNhcGFiaWxpdGllcyI6WyJjYXB0dXJlLmFjY2VwdCIsInNwYWNlLndyaXRlIl0sInJvbGVfY2xhaW1faWQiOiJyb2xlX2NsYWltXzEyM2U0NTY3LWU4OWItNDJkMy1hNDU2LTQyNjYxNDE3NDAwMyIsInJvbGVfaWQiOiJyb2xlXzEyM2U0NTY3LWU4OWItNDJkMy1hNDU2LTQyNjYxNDE3NDAwMiIsInRlbmFudF9pZCI6InRlbmFudF8xMjNlNDU2Ny1lODliLTQyZDMtYTQ1Ni00MjY2MTQxNzQwMDAifQpzY2hlbWFfdmVyc2lvbjogMQpzcGFjZV9pZDogInNwYWNlXzEyM2U0NTY3LWU4OWItNDJkMy1hNDU2LTQyNjYxNDE3NDAwNCIKc3RhdHVzOiAiYWN0aXZlIgp0ZW5hbnRfaWQ6ICJ0ZW5hbnRfMTIzZTQ1NjctZTg5Yi00MmQzLWE0NTYtNDI2NjE0MTc0MDAwIgp0aXRsZTogIlN5bnRoZXRpYyIKdHJ1c3Q6ICJvd25lciIKLS0tCgojIFN5bnRoZXRpYwo=","sha256":"a6e47db8c08945f9e56e6978496b69813a6803f62ef8a82d66a632dd9913f514"},"expected_receipt":{"kind":"proposal_created","payload":{"proposal_id":"proposal_123e4567-e89b-42d3-a456-426614174008","proposed_content_sha256":"0618524be78e28b615fb58bf6dd8470b86632f0d9338803917a09ece72b9d43d"},"receipt_id":"receipt_123e4567-e89b-42d3-a456-426614174120","recorded_at":"2026-08-30T12:00:00Z","sha256":"b5cf4bf2d1b9df6e492890f0d12f2de098003798ae02a49be983e56b055dc367","subject_id":"proposal_123e4567-e89b-42d3-a456-426614174008"},"expected_state_digest":"fdc9ef8ce3407679c26eae500835a9262a6be1e3b97533275090c331f38bd3da","outcome":"edited","proposal_id":"proposal_123e4567-e89b-42d3-a456-426614174008","recorded_at":"2026-08-30T12:06:00Z","role_claim":{"actor_id":"actor_123e4567-e89b-42d3-a456-426614174001","capabilities":["capture.accept","space.write"],"role_claim_id":"role_claim_123e4567-e89b-42d3-a456-426614174003","role_id":"role_123e4567-e89b-42d3-a456-426614174002","tenant_id":"tenant_123e4567-e89b-42d3-a456-426614174000"},"schema_version":1,"tenant_id":"tenant_123e4567-e89b-42d3-a456-426614174000","terminal_digest":"e24837203d4eecbd79324b8f020ce934b2789af34b03267b4aa9dd89d5f8e628"}